{
  "schema": "agent-workflow/dependency-lock/v1",
  "project": "agent-workflow",
  "version": "0.12.0",
  "scope": "direct-dependencies",
  "follow_up": "HARD-010",
  "packages": [
    {
      "name": "setuptools",
      "version": "82.0.1",
      "groups": [
        "build",
        "dev"
      ],
      "source_requirements": [
        "setuptools>=61"
      ]
    },
    {
      "name": "jsonschema",
      "version": "4.26.0",
      "groups": [
        "runtime"
      ],
      "source_requirements": [
        "jsonschema>=4.18,<5"
      ]
    },
    {
      "name": "pytest",
      "version": "9.0.2",
      "groups": [
        "dev"
      ],
      "source_requirements": [
        "pytest>=8,<10"
      ]
    },
    {
      "name": "build",
      "version": "1.2.2",
      "groups": [
        "dev"
      ],
      "source_requirements": [
        "build>=1.2,<2"
      ]
    },
    {
      "name": "PyYAML",
      "version": "6.0.3",
      "groups": [
        "runtime"
      ],
      "source_requirements": [
        "PyYAML>=6.0.3,<7"
      ]
    },
    {
      "name": "specgen-agent-workflow-contracts",
      "version": "0.2.1",
      "groups": [
        "legacy-specgen"
      ],
      "source_requirements": [
        "specgen-agent-workflow-contracts @ https://github.com/ngallodev-software/agent-workflow-spec-contracts/releases/download/v0.2.1/specgen_agent_workflow_contracts-0.2.1-py3-none-any.whl#sha256=d254a0b13f2fd1de732dab2abd33da35db9ea365b50b3214e92308fea79d85c2"
      ]
    },
    {
      "name": "mcp",
      "version": "1.28.1",
      "groups": [
        "mcp"
      ],
      "source_requirements": [
        "mcp==1.28.1"
      ]
    },
    {
      "name": "inspect-ai",
      "version": "0.3.247",
      "groups": [
        "eval"
      ],
      "source_requirements": [
        "inspect-ai==0.3.247"
      ]
    },
    {
      "name": "inspect-swe",
      "version": "0.2.66",
      "groups": [
        "eval"
      ],
      "source_requirements": [
        "inspect-swe==0.2.66"
      ]
    },
    {
      "name": "scipy",
      "version": "1.17.0",
      "groups": [
        "stats"
      ],
      "source_requirements": [
        "scipy>=1.11,<2"
      ]
    },
    {
      "name": "shtab",
      "version": "1.7.2",
      "groups": [
        "completion"
      ],
      "source_requirements": [
        "shtab>=1.7,<2"
      ]
    },
    {
      "name": "agent-workflow-comparative-eval",
      "version": "0.3.4",
      "groups": [
        "comparative-eval"
      ],
      "source_requirements": [
        "agent-workflow-comparative-eval>=0.3.1,<0.3.5"
      ],
      "source_revision": "70e2ee9442426d556bc4209997572d10094cab58"
    },
    {
      "name": "typesafe-sdk",
      "version": "0.6.0",
      "groups": [
        "typesafe"
      ],
      "source_requirements": [
        "typesafe-sdk==0.6.0"
      ]
    }
  ]
}
